Year,Value,UNIT_MEASURE,SERIES
2016,44,На 100.000 становника,Стопа морталитета која се приписује загађењу околног ваздуха
2016,43,На 100.000 становника,Стопа смртности која се приписује загађењем ваздуха домаћинстава
2016,80,На 100.000 становника,Старосно стандардизована стопа смртности која се приписује загађењу домаћинства и околног ваздуха (умрли на 100.000 становника)
2016,87,На 100.000 становника,Стопа сировог морталитета која се приписује загађењу околног ваздуха
2016,85,На 100.000 становника,Сирова стопа смртности која се приписује загађењем ваздуха домаћинстава
2016,159,На 100.000 становника,Стопа смртности која се приписује загађењу домаћинства и околног ваздуха
